{
  "slug": "texas-am-aggies",
  "team_name": "Texas A&M Aggies",
  "mascot": "Aggies",
  "conference": "SEC",
  "season_window": {
    "start_year": 2024,
    "end_year": 2025,
    "notes": "Program transitioning to new head coach Michael Earley after Jim Schlossnagle departure."
  },
  "location": {
    "city": "College Station",
    "state": "Texas",
    "campus": "Texas A&M University",
    "ballpark": {
      "name": "Blue Bell Park",
      "capacity": 6150,
      "surface": "Natural grass",
      "recent_upgrades": "Enhanced pitching lab tech and new LED boards completed Aug 2024."
    }
  },
  "branding": {
    "primary_color_hex": "#500000",
    "secondary_color_hex": "#FFFFFF"
  },
  "head_coach": {
    "name": "Michael Earley",
    "contract_through": "2029",
    "base_salary_estimate": 1200000,
    "staff_tenure": "First season as head coach after serving as Aggies hitting coach.",
    "playing_style": "Maintains high-octane offense with emphasis on advanced swing design."
  },
  "support_staff": {
    "pitching_coach": "Max Weiner",
    "hitting_coach": "Nolan Cain",
    "recruiting_coordinator": "Nolan Cain",
    "director_of_operations": "Will Fox",
    "analytics_lead": "Mark Brennan",
    "player_development_director": "Chandler Rome",
    "video_coordinator": "TBD"
  },
  "nil_operations": {
    "primary_collective": "12th Man+ Fund",
    "lead_contact": "Travis Dabney",
    "contact_channels": [
      "info@12thmanplus.com",
      "https://12thmanplus.com/contact"
    ],
    "recent_initiatives": "Introducing baseball locker sponsorship program for 2025 season.",
    "intel_status": "needs_verification"
  },
  "roster_overview": {
    "returning_starters": [],
    "key_departures": [],
    "incoming_transfers": [],
    "impact_freshmen": [],
    "injury_report": []
  },
  "front_office": {
    "athletic_director": "Trev Alberts",
    "baseball_admin": "Austin Berry",
    "financial_points_of_contact": [
      "12thmantickets@athletics.tamu.edu"
    ]
  },
  "historical_context": {
    "college_world_series_titles": 0,
    "sec_titles": 0,
    "last_super_regional": "2024",
    "program_trend": "Coming off CWS finals appearance; staff overhaul introduces uncertainty."
  },
  "intel_notes": [
    {
      "timestamp": "2024-10-18T09:45:00-05:00",
      "summary": "TexAgs reports Earley prioritizing retaining recruiting class; focusing on pitching coach hire finalization.",
      "source_hint": "TexAgs Radio interview",
      "confidence": "medium",
      "status": "pending"
    }
  ],
  "data_quality": {
    "last_reviewed": "2024-10-20",
    "reviewed_by": "Deep South Intel bot",
    "completeness": "sparse",
    "next_actions": "Confirm staff hires; update roster after portal commitments finalize."
  }
}
