{
  "slug": "missouri-tigers",
  "team_name": "Missouri Tigers",
  "mascot": "Tigers",
  "conference": "SEC",
  "season_window": {
    "start_year": 2024,
    "end_year": 2025,
    "notes": "Kerrick Jackson in year two of rebuild; first full offseason staff continuity."
  },
  "location": {
    "city": "Columbia",
    "state": "Missouri",
    "campus": "University of Missouri",
    "ballpark": {
      "name": "Taylor Stadium",
      "capacity": 3500,
      "surface": "Natural grass",
      "recent_upgrades": "Installing LED lighting and bullpen camera angles fall 2024."
    }
  },
  "branding": {
    "primary_color_hex": "#F1B82D",
    "secondary_color_hex": "#000000"
  },
  "head_coach": {
    "name": "Kerrick Jackson",
    "contract_through": "2028",
    "base_salary_estimate": 650000,
    "staff_tenure": "Second season at Missouri; former MLBPA agent and Memphis head coach.",
    "playing_style": "High-energy, speed-focused offense with JUCO pitching pipeline."
  },
  "support_staff": {
    "pitching_coach": "Fred Corral",
    "hitting_coach": "Shane Hopper",
    "recruiting_coordinator": "Austin Story",
    "director_of_operations": "Tyler Pack",
    "analytics_lead": "Vacant",
    "player_development_director": "Matt Hobbs",
    "video_coordinator": "TBD"
  },
  "nil_operations": {
    "primary_collective": "Every True Tiger Foundation",
    "lead_contact": "Eric Nichols",
    "contact_channels": [
      "info@everytruetiger.org",
      "https://www.everytruetiger.org/contact"
    ],
    "recent_initiatives": "Exploring shared baseball-softball NIL events during 2025 opening weekend.",
    "intel_status": "needs_verification"
  },
  "roster_overview": {
    "returning_starters": [],
    "key_departures": [],
    "incoming_transfers": [],
    "impact_freshmen": [],
    "injury_report": []
  },
  "front_office": {
    "athletic_director": "Laird Veatch",
    "baseball_admin": "Tim Jamieson",
    "financial_points_of_contact": [
      "tickets@mizzou.edu"
    ]
  },
  "historical_context": {
    "college_world_series_titles": 1,
    "sec_titles": 0,
    "last_super_regional": "2009",
    "program_trend": "Early stages of rebuild; needs facilities/NIL lift to compete."
  },
  "intel_notes": [
    {
      "timestamp": "2024-10-07T09:15:00-05:00",
      "summary": "Columbia Tribune reports staff targeting midwest JUCO catcher with pop times under 1.85.",
      "source_hint": "Columbia Daily Tribune fall baseball update",
      "confidence": "low",
      "status": "needs_follow_up"
    }
  ],
  "data_quality": {
    "last_reviewed": "2024-10-20",
    "reviewed_by": "Deep South Intel bot",
    "completeness": "sparse",
    "next_actions": "Confirm support staff assignments; gather roster attrition from 2024 season."
  }
}
