{
  "slug": "florida-gators",
  "team_name": "Florida Gators",
  "mascot": "Gators",
  "conference": "SEC",
  "season_window": {
    "start_year": 2024,
    "end_year": 2025,
    "notes": "Opening 2025 slate in renovated Condron Ballpark after 2024 CWS runner-up finish."
  },
  "location": {
    "city": "Gainesville",
    "state": "Florida",
    "campus": "University of Florida",
    "ballpark": {
      "name": "Condron Family Ballpark",
      "capacity": 7000,
      "surface": "Natural grass",
      "recent_upgrades": "Enhanced player nutrition center and pitching lab in summer 2024."
    }
  },
  "branding": {
    "primary_color_hex": "#0021A5",
    "secondary_color_hex": "#FA4616"
  },
  "head_coach": {
    "name": "Kevin O'Sullivan",
    "contract_through": "2031",
    "base_salary_estimate": 1500000,
    "staff_tenure": "Entering 18th season; 2017 national champion.",
    "playing_style": "Power pitching, launch-angle heavy offense, heavy analytics integration.",
    "recent_quotes": "Told GatorSports in Sept 2024 that bullpen usage will lean on 'matchup pods' with two closers."
  },
  "support_staff": {
    "pitching_coach": "Brady Singer (interim volunteer consultant)",
    "hitting_coach": "Chuck Jeroloman",
    "recruiting_coordinator": "Craig Bell",
    "director_of_operations": "Brian Levin",
    "analytics_lead": "Preston Tucker",
    "player_development_director": "Tyler Holt",
    "video_coordinator": "Kyle Thompson"
  },
  "nil_operations": {
    "primary_collective": "Florida Victorious",
    "lead_contact": "Jose Costa",
    "contact_channels": [
      "baseball@floridavictorious.com",
      "https://floridavictorious.com/contact"
    ],
    "recent_initiatives": "Expanded baseball-specific membership tier with exclusive fall scrimmage streams (Sept 2024).",
    "intel_status": "needs_verification"
  },
  "roster_overview": {
    "returning_starters": [],
    "key_departures": [],
    "incoming_transfers": [],
    "impact_freshmen": [],
    "injury_report": []
  },
  "front_office": {
    "athletic_director": "Scott Stricklin",
    "baseball_admin": "Rachel Lawson",
    "financial_points_of_contact": [
      "ticketoffice@gators.ufl.edu"
    ]
  },
  "historical_context": {
    "college_world_series_titles": 1,
    "sec_titles": 8,
    "last_super_regional": "2024",
    "program_trend": "Sustained national-title push anchored by elite recruiting and NIL backing."
  },
  "intel_notes": [
    {
      "timestamp": "2024-10-05T11:00:00-04:00",
      "summary": "Condron Ballpark pitching lab now hosts shared biomechanics sessions with softball program twice weekly.",
      "source_hint": "Gainesville Sun facility walkthrough",
      "confidence": "medium",
      "status": "pending"
    }
  ],
  "data_quality": {
    "last_reviewed": "2024-10-20",
    "reviewed_by": "Deep South Intel bot",
    "completeness": "sparse",
    "next_actions": "Need updated roster status after 2024 MLB Draft; validate staff adjustments (Singer consultant role)."
  }
}
